0,1,2,3,4,5,6
1,masks,Face Mask with Nose Wire Triple Layers plus Filter / Adjustable and Washable Facemask UK / Printed Soft Comfy Premium Cotton Face Mask Pack,4.8374,2.86,https://www.etsy.com/listing/810215765/face-mask-with-nose-wire-triple-layers?ga_order=most_relevant&ga_search_type=all&ga_view_type=gallery&ga_search_query=masks&ref=sc_gallery-1-1&plkey=933db3a3edf77cc5420703156693665f1f673981%3A810215765&bes=1&col=1,https://i.etsystatic.com/6630281/c/2700/2146/0/46/il/823dc3/2970582302/il_340x270.2970582302_978z.jpg
2,masks,Same Day Dispatch -  MADE IN UK - Silk Face Mask - Silk Satin Face Mask - Double Layered Mask -Reusable Mask - Cloth Face Mask,4.7221,1.83,https://www.etsy.com/listing/804173442/same-day-dispatch-made-in-uk-silk-face?ga_order=most_relevant&ga_search_type=all&ga_view_type=gallery&ga_search_query=masks&ref=sc_gallery-1-2&plkey=fcfb61aee92a2a2d4b2499cc07d13797b8017f49%3A804173442&pro=1&col=1,https://i.etsystatic.com/21703996/c/3000/2384/0/0/il/94fd80/2907326099/il_340x270.2907326099_3p25.jpg
3,masks,UK MADE Silk Face Mask Same Day Dispatch Free Delivery Free Mask Chain Offer Ultra Soft Silk Satin Face Mask Nose Wire+Adjustable Face Mask,4.8402,9.35,https://www.etsy.com/listing/866463320/uk-made-silk-face-mask-same-day-dispatch?ga_order=most_relevant&ga_search_type=all&ga_view_type=gallery&ga_search_query=masks&ref=sc_gallery-1-3&plkey=8468fd74d64d6c30eaee1cb8bc8188a8573df277%3A866463320&bes=1,https://i.etsystatic.com/23382228/d/il/39ba3f/2894481001/il_340x270.2894481001_7qkb.jpg?version=0
4,masks,6-Pack Face Masks // Face Masks with Filter Pocket // Soft Cotton Face Mask // Face Masks for Women and Men / Face Masks Adult // Face Masks,4.7984,24.95,https://www.etsy.com/listing/809556965/6-pack-face-masks-face-masks-with-filter?ga_order=most_relevant&ga_search_type=all&ga_view_type=gallery&ga_search_query=masks&ref=sc_gallery-1-4&plkey=ff49ac53d4980c7d7bb053c072dea086b59cdc61%3A809556965&bes=1,https://i.etsystatic.com/10701776/d/il/90fa10/2389366409/il_340x270.2389366409_h3jj.jpg?version=0
5,masks,Face Mask with Nose Wire Triple Layers plus Filter / Adjustable and Washable Facemask UK / Printed Soft Comfy Premium Cotton Face Mask Pack,4.8374,2.86,https://www.etsy.com/listing/810215765/face-mask-with-nose-wire-triple-layers?ga_order=most_relevant&ga_search_type=all&ga_view_type=gallery&ga_search_query=masks&ref=sr_gallery-1-1&organic_search_click=1&bes=1&col=1,https://i.etsystatic.com/6630281/c/2700/2146/0/46/il/823dc3/2970582302/il_340x270.2970582302_978z.jpg
6,masks,UK MADE Silk Face Mask Same Day Dispatch Free Delivery Free Mask Chain Offer Ultra Soft Silk Satin Face Mask Nose Wire+Adjustable Face Mask,4.8402,9.35,https://www.etsy.com/listing/866463320/uk-made-silk-face-mask-same-day-dispatch?ga_order=most_relevant&ga_search_type=all&ga_view_type=gallery&ga_search_query=masks&ref=sr_gallery-1-2&organic_search_click=1&bes=1,https://i.etsystatic.com/23382228/d/il/39ba3f/2894481001/il_340x270.2894481001_7qkb.jpg?version=0
7,masks,"Super Soft Face Mask, Silk Satin Face Mask, UK Made, Washable & Reusable Face Mask, High Quality, Double Layered, Comfortable to wear",4.8975,8.40,https://www.etsy.com/listing/837180950/super-soft-face-mask-silk-satin-face?ga_order=most_relevant&ga_search_type=all&ga_view_type=gallery&ga_search_query=masks&ref=sr_gallery-1-3&organic_search_click=1&pro=1&col=1,https://i.etsystatic.com/23827817/d/il/42428a/2930300177/il_340x270.2930300177_h1tm.jpg?version=0
8,masks,Face Mask TRIPLE LAYER. Made in UK Face Mask. Adjustable + Nose Wire Face Mask. Filter Face Mask. Washable Face Mask. Reusable Face Mask U.K,4.8402,2.86,https://www.etsy.com/listing/816232034/face-mask-triple-layer-made-in-uk-face?ga_order=most_relevant&ga_search_type=all&ga_view_type=gallery&ga_search_query=masks&ref=sr_gallery-1-4&organic_search_click=1&bes=1&col=1,https://i.etsystatic.com/23382228/d/il/62df41/2851066361/il_340x270.2851066361_3lb3.jpg?version=0
9,masks,Black Silk Face Mask - Designer Face Mask - Reusable Face Mask - Neutral Face Mask - Trendy Mask - Face Mask - Black Mask - Maske Seide,4.7222,9.58,https://www.etsy.com/listing/856364717/black-silk-face-mask-designer-face-mask?ga_order=most_relevant&ga_search_type=all&ga_view_type=gallery&ga_search_query=masks&ref=sr_gallery-1-5&organic_search_click=1&pro=1&col=1,https://i.etsystatic.com/24710229/d/il/ae5c9d/2561639143/il_340x270.2561639143_6p0s.jpg?version=0
10,masks,"TRIPLE LAYER Face Mask, Filtered Face Mask, Cloth Fabric Face Mask, Adjustable + Nose Wire Face Mask. Washable Face Mask. Reusable Face Mask",4.8402,2.86,https://www.etsy.com/listing/854268266/triple-layer-face-mask-filtered-face?ga_order=most_relevant&ga_search_type=all&ga_view_type=gallery&ga_search_query=masks&ref=sr_gallery-1-6&organic_search_click=1&bes=1&col=1,https://i.etsystatic.com/23382228/d/il/01dda4/2803387190/il_340x270.2803387190_59df.jpg?version=0
11,masks,Triple Layer Face Mask UK • Reusable Washable Face Mask 3 Layer Filter •  Cotton Black Face Covering handmade • Free delivery,4.679,3.44,https://www.etsy.com/listing/793606963/triple-layer-face-mask-uk-reusable?ga_order=most_relevant&ga_search_type=all&ga_view_type=gallery&ga_search_query=masks&ref=sr_gallery-1-7&organic_search_click=1&pro=1,https://i.etsystatic.com/22823837/c/1720/1367/0/727/il/82f0a6/2267304604/il_340x270.2267304604_akle.jpg
12,masks,Face mask silk Ultra Soft Silk Satin Fabric hand made in the UK Washable and Reusable High Quality Dust face covering pleated FREE DELIVERY,4.9506,8.57,https://www.etsy.com/listing/868670443/face-mask-silk-ultra-soft-silk-satin?ga_order=most_relevant&ga_search_type=all&ga_view_type=gallery&ga_search_query=masks&ref=sr_gallery-1-8&organic_search_click=1&pro=1&col=1,https://i.etsystatic.com/24368106/d/il/aa0c49/2671812026/il_340x270.2671812026_2aud.jpg?version=0
13,masks,Cheesecloth/gauze mask face covering,4.9579,12.99,https://www.etsy.com/listing/868748359/cheeseclothgauze-mask-face-covering?ga_order=most_relevant&ga_search_type=all&ga_view_type=gallery&ga_search_query=masks&ref=sc_gallery-2-1&plkey=db5b36c88a1500148eb4353cf53da99764250acc%3A868748359&bes=1&col=1,https://i.etsystatic.com/24238301/d/il/114bb1/2786716551/il_340x270.2786716551_rwwq.jpg?version=0
14,masks,TRIPLE LAYER 3 Pack Ladies Face Mask with Nose Wire for Glasses / Washable 100% Soft Cotton with Filter / Anti Fog Floral Cloth Mask,4.8374,2.86,https://www.etsy.com/listing/810177445/triple-layer-3-pack-ladies-face-mask?ga_order=most_relevant&ga_search_type=all&ga_view_type=gallery&ga_search_query=masks&ref=sc_gallery-2-2&plkey=1537704373b8411222dc01ce2e9cd56c786a2a04%3A810177445&bes=1,https://i.etsystatic.com/6630281/d/il/e13a29/2969864448/il_340x270.2969864448_1zs0.jpg?version=0
15,masks,Face Mask with Nose Wire Filter Pocket Washable Cotton Face Mask Protective 3 layer,4.8952,3.99,https://www.etsy.com/listing/833653733/face-mask-with-nose-wire-filter-pocket?ga_order=most_relevant&ga_search_type=all&ga_view_type=gallery&ga_search_query=masks&ref=sc_gallery-2-3&plkey=fc6aaf8d96568fca05357d471571f1bb246b2b16%3A833653733&pro=1&col=1,https://i.etsystatic.com/22958525/d/il/4d4c87/2824083597/il_340x270.2824083597_24sw.jpg?version=0
16,masks,NYNJA® Glazed Beige Face Mask - Reusable - Soft Cotton - Filter pocket - Three Layers option PM 2.5 filter - High quality and comfort,4.4868,5.13,https://www.etsy.com/listing/793313392/nynja-glazed-beige-face-mask-reusable?ga_order=most_relevant&ga_search_type=all&ga_view_type=gallery&ga_search_query=masks&ref=sc_gallery-2-4&plkey=fd5c3058a7d89441133ca31979bce8d3c60f56a8%3A793313392&pro=1,https://i.etsystatic.com/23222847/d/il/4b673b/2618883862/il_340x270.2618883862_rqye.jpg?version=0
17,masks,"Mulberry 100% Silk Face Mask. Nose Wire 2 Layers, Washable, Adjustable. Handmade in UK.",4.8734,20.13,https://www.etsy.com/listing/810740916/mulberry-100-silk-face-mask-nose-wire-2?ga_order=most_relevant&ga_search_type=all&ga_view_type=gallery&ga_search_query=masks&ref=sc_gallery-2-5&plkey=76131614ede45a44d169ed4e094af1106e918ec0%3A810740916&bes=1,https://i.etsystatic.com/22941177/d/il/7448b0/2982598963/il_340x270.2982598963_d2os.jpg?version=0
18,masks,"Handmade, Celestial, Reusable/Washable Face Masks, Adult Size",4.974,4.32,https://www.etsy.com/listing/968638067/handmade-celestial-reusablewashable-face?ga_order=most_relevant&ga_search_type=all&ga_view_type=gallery&ga_search_query=masks&ref=sr_gallery-2-1&organic_search_click=1,https://i.etsystatic.com/21803579/d/il/ef2bb0/2845226830/il_340x270.2845226830_a4m1.jpg?version=0
19,masks,Face Mask Kids & Adult Adjustable Masks HandMade in UK Soft Cotton Face Covering Cover,4.6824,4.30,https://www.etsy.com/listing/845325932/face-mask-kids-adult-adjustable-masks?ga_order=most_relevant&ga_search_type=all&ga_view_type=gallery&ga_search_query=masks&ref=sr_gallery-2-2&organic_search_click=1&bes=1&col=1,https://i.etsystatic.com/23077253/d/il/4b88d0/2483835878/il_340x270.2483835878_jdv1.jpg?version=0
20,masks,Same Day Dispatch - SET OF 3 - Silk Face Mask - Made in UK -  Adult Face Mask - Black Mask - Cloth Face Mask - Black Silk Face Mask,4.7221,1.83,https://www.etsy.com/listing/805601968/same-day-dispatch-set-of-3-silk-face?ga_order=most_relevant&ga_search_type=all&ga_view_type=gallery&ga_search_query=masks&ref=sr_gallery-2-3&organic_search_click=1&pro=1&col=1,https://i.etsystatic.com/21703996/c/3000/2384/0/0/il/40cec5/2859667738/il_340x270.2859667738_5fbs.jpg
21,masks,3 Layer Mask - STITCHED LOGO - Nike Sports Face Mask - High Quality Cotton - Adjustable Size,4.7037,12.93,https://www.etsy.com/listing/921176306/3-layer-mask-stitched-logo-nike-sports?ga_order=most_relevant&ga_search_type=all&ga_view_type=gallery&ga_search_query=masks&ref=sr_gallery-2-4&organic_search_click=1&pro=1&col=1,https://i.etsystatic.com/26326682/d/il/e4a80b/2850873612/il_340x270.2850873612_ehpc.jpg?version=0
22,masks,Triple 3 layer face mask U.K. covering triple  3 layer washable cotton reusable,4.9242,5.68,https://www.etsy.com/listing/857840202/triple-3-layer-face-mask-uk-covering?ga_order=most_relevant&ga_search_type=all&ga_view_type=gallery&ga_search_query=masks&ref=sr_gallery-2-5&organic_search_click=1&bes=1,https://i.etsystatic.com/25028401/d/il/b1fb28/2761850636/il_340x270.2761850636_r9ew.jpg?version=0
23,masks,Triple Layer Natural Organic Pure Linen and Cotton Face Masks with Adjustable Ear Loops and Filter. Different Styles Available,4.7663,9.01,https://www.etsy.com/listing/892227284/triple-layer-natural-organic-pure-linen?ga_order=most_relevant&ga_search_type=all&ga_view_type=gallery&ga_search_query=masks&ref=sr_gallery-2-6&organic_search_click=1&pro=1,https://i.etsystatic.com/24131207/d/il/ef4699/2666424368/il_340x270.2666424368_f2a4.jpg?version=0
24,masks,"Reusable cotton face masks + free filter, washable face masks, adult / child mask, adjustable elastic face mask, filter pocket face mask",4.8043,3.75,https://www.etsy.com/listing/789884445/reusable-cotton-face-masks-free-filter?ga_order=most_relevant&ga_search_type=all&ga_view_type=gallery&ga_search_query=masks&ref=sr_gallery-2-7&organic_search_click=1&pro=1,https://i.etsystatic.com/21311879/d/il/9f8f28/2820921328/il_340x270.2820921328_xfkk.jpg?version=0
25,masks,"Super soft Silk Face Mask, Double Layered silk face Mask, Adjustable face mask, Washable Reusable Mask, High Quality face Mask,FAST DELIVERY",4.866,1.88,https://www.etsy.com/listing/832750106/super-soft-silk-face-mask-double-layered?ga_order=most_relevant&ga_search_type=all&ga_view_type=gallery&ga_search_query=masks&ref=sr_gallery-2-8&organic_search_click=1&pro=1&col=1,https://i.etsystatic.com/24422750/d/il/1d8fcb/2938618876/il_340x270.2938618876_4ab6.jpg?version=0
26,masks,Organic Cheesecloth Face mask Reusable Breathable Lightweight Natural Colour Unbleached Cotton Free to breathe Adult student,4.7736,8.62,https://www.etsy.com/listing/890792387/organic-cheesecloth-face-mask-reusable?ga_order=most_relevant&ga_search_type=all&ga_view_type=gallery&ga_search_query=masks&ref=sr_gallery-2-9&organic_search_click=1&bes=1,https://i.etsystatic.com/20178242/d/il/7ef3ae/2605635462/il_340x270.2605635462_onkh.jpg?version=0
27,masks,Christian Design Inspired Face Mask,4.8,12.88,https://www.etsy.com/listing/986623367/christian-design-inspired-face-mask?ga_order=most_relevant&ga_search_type=all&ga_view_type=gallery&ga_search_query=masks&ref=sr_gallery-2-10&organic_search_click=1,https://i.etsystatic.com/27674557/d/il/0dcf4f/3010287459/il_340x270.3010287459_payi.jpg?version=0
28,masks,"100% Mulberry Silk Face Masks, Reusable Face Mask, Washable Face Mask, Handmade Face Mask, Satin Face Mask",4.8154,9.00,https://www.etsy.com/listing/899173571/100-mulberry-silk-face-masks-reusable?ga_order=most_relevant&ga_search_type=all&ga_view_type=gallery&ga_search_query=masks&ref=sc_gallery-3-1&plkey=d360a781fe14185866e352b12e231576207aaf73%3A899173571&pro=1&col=1,https://i.etsystatic.com/22726777/c/1952/1551/542/166/il/b602f9/2982402420/il_340x270.2982402420_39ti.jpg
29,masks,"BLUE | Anti Fog Face Mask for Glasses Washable & Reusable Cotton-With Nose Wire,inner Filter Pocket And Adjustable Ear Loops+ 5 Filters Gift",4.3776,4.30,https://www.etsy.com/listing/905095927/blue-anti-fog-face-mask-for-glasses?ga_order=most_relevant&ga_search_type=all&ga_view_type=gallery&ga_search_query=masks&ref=sc_gallery-3-2&plkey=4bf4c669bace23168a4e4a56b5de6384e49b9709%3A905095927&bes=1&col=1,https://i.etsystatic.com/25004611/c/794/631/0/61/il/c6d148/3013353047/il_340x270.3013353047_9zsp.jpg
30,masks,Tie Dye Face Mask Reusable and Washable Protective // Made in USA! Soft Cotton Breathable Fashionable,4.816,6.20,https://www.etsy.com/listing/799623903/tie-dye-face-mask-reusable-and-washable?ga_order=most_relevant&ga_search_type=all&ga_view_type=gallery&ga_search_query=masks&ref=sc_gallery-3-3&plkey=126394e0f81e0d10715927cb1892b4d868c358c5%3A799623903&bes=1&col=1,https://i.etsystatic.com/23007997/c/754/599/0/51/il/759779/2974853905/il_340x270.2974853905_qa5d.jpg
31,masks,"Disposable Wedding Masks for Guests, Custom Disposable Mask, Wedding Favors, Mr and Mrs Masks, Party Favors, Mask Wedding Favors",4.8519,15.99,https://www.etsy.com/listing/965007529/disposable-wedding-masks-for-guests?ga_order=most_relevant&ga_search_type=all&ga_view_type=gallery&ga_search_query=masks&ref=sc_gallery-3-4&plkey=8bad5867693fe12c04854a1ae5a20dc20264025f%3A965007529&bes=1&col=1,https://i.etsystatic.com/12366941/c/1539/1223/506/381/il/543a62/2928201461/il_340x270.2928201461_cumj.jpg
32,masks,Custom Duck Face Masks - Bird Face Masks - Bird Masks - Hand Made in the UK - Choose your colour!,4.5591,23.02,https://www.etsy.com/listing/881645020/custom-duck-face-masks-bird-face-masks?ga_order=most_relevant&ga_search_type=all&ga_view_type=gallery&ga_search_query=masks&ref=sr_gallery-3-1&organic_search_click=1,https://i.etsystatic.com/25586541/d/il/9ad2ce/2726324943/il_340x270.2726324943_nanx.jpg?version=0
33,masks,HEROS Satin Mask,4.9138,7.35,https://www.etsy.com/listing/794800636/heros-satin-mask?ga_order=most_relevant&ga_search_type=all&ga_view_type=gallery&ga_search_query=masks&ref=sr_gallery-3-2&organic_search_click=1&bes=1&col=1,https://i.etsystatic.com/17743682/d/il/b33d63/2699353892/il_340x270.2699353892_eeto.jpg?version=0
34,masks,"Personalised Face mask for Adult I Breathable, Reusable, Washable Custom Text Wedding Wording Name, 2 Ply, Wedding Guest Mask, Business Mask",4.6801,7.18,https://www.etsy.com/listing/938919061/personalised-face-mask-for-adult-i?ga_order=most_relevant&ga_search_type=all&ga_view_type=gallery&ga_search_query=masks&ref=sr_gallery-3-3&organic_search_click=1&bes=1,https://i.etsystatic.com/22882452/d/il/f12bca/2780648680/il_340x270.2780648680_f90n.jpg?version=0
35,masks,"Handmade Adjustable MEN Face Mask, Face Covering, Mask for MEN, Men Masks, Men Face Mask UK, Reusable Mask, Men Face Cover, PearleeShop",4.9751,6.11,https://www.etsy.com/listing/855043404/handmade-adjustable-men-face-mask-face?ga_order=most_relevant&ga_search_type=all&ga_view_type=gallery&ga_search_query=masks&ref=sr_gallery-3-4&organic_search_click=1&bes=1,https://i.etsystatic.com/24675931/d/il/1cb000/2994743033/il_340x270.2994743033_5k6j.jpg?version=0
36,masks,Peloton Cycling Face Mask Reusable Face Covering - Large - Bike Bicycle Print - One Size - Non Medical Grade Cycling Birthday Tour de France,4.9319,6.47,https://www.etsy.com/listing/888382815/peloton-cycling-face-mask-reusable-face?ga_order=most_relevant&ga_search_type=all&ga_view_type=gallery&ga_search_query=masks&ref=sr_gallery-3-5&organic_search_click=1&bes=1,https://i.etsystatic.com/6811326/d/il/43835a/2595969752/il_340x270.2595969752_dnze.jpg?version=0
37,masks,"Reusable Face Mask With Room For BEARD, 3 Lengths, Filter Pocket and Nose Wire, Ergonomic, Stylish, PM2.5 Filter Friendly, Made in Britain",4.8545,18.69,https://www.etsy.com/listing/800634996/reusable-face-mask-with-room-for-beard-3?ga_order=most_relevant&ga_search_type=all&ga_view_type=gallery&ga_search_query=masks&ref=sr_gallery-3-6&organic_search_click=1&bes=1,https://i.etsystatic.com/23141939/c/2000/1589/0/239/il/e991e2/2760977740/il_340x270.2760977740_9q4k.jpg
38,masks,"Face Mask for Glasses, Anti Fog Antifog Steam, Double Layer Cotton, Filter Pocket, Washable & Reusable",4.8494,9.93,https://www.etsy.com/listing/897041357/face-mask-for-glasses-anti-fog-antifog?ga_order=most_relevant&ga_search_type=all&ga_view_type=gallery&ga_search_query=masks&ref=sr_gallery-3-7&organic_search_click=1&frs=1&bes=1&col=1,https://i.etsystatic.com/22923315/d/il/0df45c/2849501494/il_340x270.2849501494_a3r6.jpg?version=0
39,masks,Kids sport Nike inspired Embroidered face mask cotton Adjustable ear loops washable,4.875,5.04,https://www.etsy.com/listing/971218813/kids-sport-nike-inspired-embroidered?ga_order=most_relevant&ga_search_type=all&ga_view_type=gallery&ga_search_query=masks&ref=sr_gallery-3-8&organic_search_click=1&bes=1&col=1,https://i.etsystatic.com/27807990/d/il/863601/2952700247/il_340x270.2952700247_oneo.jpg?version=0
40,masks,"Face Mask with Straw hole, Zipper face mask, Breathable Face Mask with filter pocket and nose wire Washable mask for drinking Anti fog mask",4.6939,5.50,https://www.etsy.com/listing/968439526/face-mask-with-straw-hole-zipper-face?ga_order=most_relevant&ga_search_type=all&ga_view_type=gallery&ga_search_query=masks&ref=sc_gallery-4-1&plkey=7390c71ecdabde94cbca067c6068d89790262eda%3A968439526&col=1,https://i.etsystatic.com/23218806/d/il/7ee175/2946910924/il_340x270.2946910924_t928.jpg?version=0
41,masks,Mickey Mouse || Disney contoured fitted face mask lightweight cotton washable reversible adjustable strap Made in USA ** Fast Ship,4.9511,15.50,https://www.etsy.com/listing/946937741/mickey-mouse-disney-contoured-fitted?ga_order=most_relevant&ga_search_type=all&ga_view_type=gallery&ga_search_query=masks&ref=sc_gallery-4-2&plkey=abe43b4bab493100f10cfb4af531498748ee7e02%3A946937741&frs=1&bes=1&col=1,https://i.etsystatic.com/6935318/d/il/c06d0d/2884169937/il_340x270.2884169937_m1ae.jpg?version=0
42,masks,"Face Mask WOMENS Sequin, Washable, Adjustable, Breathable, Reusable, Cotton Mask, Wedding Face Mask, Sequin Face Mask, Womens Face Mask,",4.8386,8.62,https://www.etsy.com/listing/851879559/face-mask-womens-sequin-washable?ga_order=most_relevant&ga_search_type=all&ga_view_type=gallery&ga_search_query=masks&ref=sc_gallery-4-3&plkey=1bb79202615d5c471eb9557f2fb9e33b64b813ba%3A851879559&bes=1&col=1,https://i.etsystatic.com/19836824/d/il/54af7a/2883724888/il_340x270.2883724888_2b7b.jpg?version=0
43,masks,Tie Dye Face Mask Reusable and Washable Protective // Made in USA! Soft Cotton Breathable Fashionable,4.816,6.20,https://www.etsy.com/listing/799623903/tie-dye-face-mask-reusable-and-washable?ga_order=most_relevant&ga_search_type=all&ga_view_type=gallery&ga_search_query=masks&ref=sc_gallery-4-4&plkey=860fda0b41f9e06ba413e7e933ee7447d52eb6fc%3A799623903&bes=1&col=1,https://i.etsystatic.com/23007997/c/754/599/0/51/il/759779/2974853905/il_340x270.2974853905_qa5d.jpg
44,masks,Keith Haring Black and  White Face Mask | Safe Not Boring (SKU:FMF-POP-008),4.878,11.51,https://www.etsy.com/listing/884039467/keith-haring-black-and-white-face-mask?ga_order=most_relevant&ga_search_type=all&ga_view_type=gallery&ga_search_query=masks&ref=sr_gallery-4-1&organic_search_click=1,https://i.etsystatic.com/23591562/c/2048/1626/0/0/il/7bf62a/2844724435/il_340x270.2844724435_50q1.jpg
45,masks,Pack of 5 White or Black Face mask Reusable Cotton Washable Multipack Face Covering in UK~ Five Emperors,4.6543,11.49,https://www.etsy.com/listing/923404962/pack-of-5-white-or-black-face-mask?ga_order=most_relevant&ga_search_type=all&ga_view_type=gallery&ga_search_query=masks&ref=sr_gallery-4-2&organic_search_click=1&bes=1,https://i.etsystatic.com/24555620/d/il/1e4a74/2949652861/il_340x270.2949652861_4p47.jpg?version=0
46,masks,"5 PACK BLACK Face Mask Washable & Reusable Extra Cushioned Cotton Soft Padding Touch -  Without Nose Wire,  Adjustable Ear Loops",4.3776,4.30,https://www.etsy.com/listing/926603733/5-pack-black-face-mask-washable-reusable?ga_order=most_relevant&ga_search_type=all&ga_view_type=gallery&ga_search_query=masks&ref=sr_gallery-4-3&organic_search_click=1&bes=1&col=1,https://i.etsystatic.com/25004611/d/il/8aa82e/2740162922/il_340x270.2740162922_55t6.jpg?version=0
47,masks,Avengers Face Mask / Washable Face Mask / Reusable Face Mask / Face Masks & Coverings / Face Mask Washable,4.8909,5.74,https://www.etsy.com/listing/852272390/avengers-face-mask-washable-face-mask?ga_order=most_relevant&ga_search_type=all&ga_view_type=gallery&ga_search_query=masks&ref=sr_gallery-4-4&organic_search_click=1&pro=1,https://i.etsystatic.com/24913763/d/il/5038a8/2620168979/il_340x270.2620168979_l8aq.jpg?version=0
48,masks,Womens / Teenage Girls Black Red Pink Cotton Filter Pocket Face Mask Reusable Washable Breathable Adjustable in the Uk with Nose Wire NEW,4.5741,4.29,https://www.etsy.com/listing/907432818/womens-teenage-girls-black-red-pink?ga_order=most_relevant&ga_search_type=all&ga_view_type=gallery&ga_search_query=masks&ref=sr_gallery-4-5&organic_search_click=1,https://i.etsystatic.com/25982071/d/il/4774aa/2771415211/il_340x270.2771415211_juft.jpg?version=0
49,masks,Welsh Flag Face Mask Protective Covering Washable Reusable Breathable Cover Wales Dragon,4.6266,8.19,https://www.etsy.com/listing/876213494/welsh-flag-face-mask-protective-covering?ga_order=most_relevant&ga_search_type=all&ga_view_type=gallery&ga_search_query=masks&ref=sr_gallery-4-6&organic_search_click=1&bes=1,https://i.etsystatic.com/20568465/d/il/f12334/2603073500/il_340x270.2603073500_ejyw.jpg?version=0
50,masks,Womens / Teenage Girls Black Red Pink Cotton Filter Pocket Face Mask Reusable Washable Breathable Adjustable in the Uk with Nose Wire NEW,4.5741,5.70,https://www.etsy.com/listing/929153609/womens-teenage-girls-black-red-pink?ga_order=most_relevant&ga_search_type=all&ga_view_type=gallery&ga_search_query=masks&ref=sr_gallery-4-7&organic_search_click=1,https://i.etsystatic.com/25982071/d/il/f3a879/2795619131/il_340x270.2795619131_49bl.jpg?version=0
51,masks,Filter For Face Mask Washable - Sheets For Mask Filter MERV13 - Reusable Filter Sheets - 50g Short Cellulose Fibre Filter - 1st class,4.2311,7.91,https://www.etsy.com/listing/802498653/filter-for-face-mask-washable-sheets-for?ga_order=most_relevant&ga_search_type=all&ga_view_type=gallery&ga_search_query=masks&ref=sr_gallery-4-8&organic_search_click=1&bes=1,https://i.etsystatic.com/22572550/c/2191/1741/0/599/il/f9987c/2829436071/il_340x270.2829436071_pn1e.jpg
52,masks,Same Day Dispatch -  MADE IN UK - Silk Face Mask Reversible Double Layered Mask -Reusable Mask - Cloth Face Mask,4.7221,14.67,https://www.etsy.com/listing/917658701/same-day-dispatch-made-in-uk-silk-face?ga_order=most_relevant&ga_search_type=all&ga_view_type=gallery&ga_search_query=masks&ref=sc_gallery-5-1&plkey=466d92bd6edfcf5671f20bea869a482f74494de4%3A917658701&pro=1&col=1,https://i.etsystatic.com/21703996/c/3000/2384/0/25/il/e9a07f/2918674876/il_340x270.2918674876_mghk.jpg
53,masks,"Extra Large Face Mask, 1 Day Delivery Available, XL Mens Face Mask Made Especially for Men with Large and Big Heads, Great For Beards!",4.7816,9.99,https://www.etsy.com/listing/792223823/extra-large-face-mask-1-day-delivery?ga_order=most_relevant&ga_search_type=all&ga_view_type=gallery&ga_search_query=masks&ref=sc_gallery-5-2&plkey=464d3a6cb45bd33890e61a5a93e609917914a814%3A792223823&bes=1&col=1,https://i.etsystatic.com/22508153/d/il/63126f/2428966182/il_340x270.2428966182_39cu.jpg?version=0
54,masks,Organic Cotton - Antibacterial Face Mask for Adult Fall face mask Adjustable Earloop Washable Reusable Unisex fancy face mask light weight,4.845,8.99,https://www.etsy.com/listing/856931364/organic-cotton-antibacterial-face-mask?ga_order=most_relevant&ga_search_type=all&ga_view_type=gallery&ga_search_query=masks&ref=sc_gallery-5-3&plkey=a7efa8cf881c0dcf19300c3481ab406400b80d56%3A856931364&col=1,https://i.etsystatic.com/23662313/d/il/97540e/2802522675/il_340x270.2802522675_5yso.jpg?version=0
55,masks,5 Pack 100% Organic Cotton Reusable Face Mask Made In The USA Facemask FitsTeens Adults Black White Red Gray Navy Blue Unisex Facemasks,4.7175,11.99,https://www.etsy.com/listing/801400634/5-pack-100-organic-cotton-reusable-face?ga_order=most_relevant&ga_search_type=all&ga_view_type=gallery&ga_search_query=masks&ref=sc_gallery-5-4&plkey=86ee3a94433b21805b2f255d704148072ca8d629%3A801400634&bes=1&col=1,https://i.etsystatic.com/19353091/d/il/0c1e04/2334655050/il_340x270.2334655050_dfjk.jpg?version=0
56,masks,"Mask pouch, storage case",5.0,9.80,https://www.etsy.com/listing/951361643/mask-pouch-storage-case?ga_order=most_relevant&ga_search_type=all&ga_view_type=gallery&ga_search_query=masks&ref=sr_gallery-5-1&organic_search_click=1,https://i.etsystatic.com/22644262/d/il/8894c3/2875847357/il_340x270.2875847357_rfjl.jpg?version=0
